,title,description,article_text
0,Pele reassures fans of health with social media post from hospital,Brazil icon Pele updated fans worried about his health with a post from Albert Einstein Hospital in Sao Paulo.," Pele has been undergoing chemotherapy for bowel cancer since last September, and there were dire local media reports on his condition earlier onSaturday. However, the 82-year-old has now offered an update on his condition and thanked fans for the many messages of support he has received. ""My friends, I want to keep everyone calm and positive,"" Pele wrote on Instagram. ""I'm strong, with a lot of hope and I follow my treatment as usual. I want to thank the entire medical and nursing team for all the care I have received. ""I have a lot of faith in God and every message of love I receive from you all over the world keeps me full of energy. And watch Brazil in the World Cup too! ""Thank you so much for everything."" The Hospital Israelita Albert Einstein also issued a statement on Saturday regarding Pele. The hospital stated the Brazilian was ""stable, with a general improvement in his health status.""  Which was the best World Cup winning team? Which was the best World Cup winning team?"
1,"Messi is a footballing God! Argentina winners, losers & ratings as Leo carries Scaloni's side into World Cup quarter-finals",Lionel Scaloni's side edged past Australia to set-up a mouth-watering meeting with the Netherlands - and their No.10 was at his devastating best.," Lionel Messi has his first goal in the knockout stage of a World Cup, and boy was it a crucial one, with the Argentina captain breaking the deadlock out of nowhere in a hard-fought 2-1 win over Australia. Up until that point, the Socceroos had frustrated the life out of the Argentina fans, who once again took over nearly an entire stadium here in Qatar. They had come to see Lionel Messi mark the 1000th game of his incredible career with another masterclass, and they eventually got one, but, for the first 35 minutes, pretty much nothing happened. The No.10 was quickly surrounded by yellow shirts every time he received the ball and he struggled to impose himself on the proceedings. Nobody else in an Argentine shirt looked like making a breakthrough either.  If history has taught us anything, though, it's that Messi only needs a split second to score, and that's precisely what he did, reacting first to what looked more like a loose touch than a lay-off from Nicolas Otamendi.  That lethal left foot took care of the rest, with the Paris Saint-Germain star simply passing the ball into the bottom corner of the Australia net. Julian Alvarez then took advantage of a shocking mistake from Mathew Ryan to make it 2-0 and although Australia set up a tense finale courtesy of a speculative shot from Craig Goodwin that deflected in off Enzo Fernandez, Argentina held on thanks to a terrific late block from Lisandro Martinez, and a fine stop from namesake Emiliano. Below, GOAL breaks down the winners, losers and ratings from another memorable night for Messi's Argentina..."
2,"Netherlands World Cup 2022 squad, predicted quarter-final line-up vs Argentina and star players",Who will get the nod from head coach Louis van Gaal as the Dutch try to seal a place in the semi-finals?," The Netherlands are back at the World Cup after missing the 2018 edition and head coach Louis van Gaal will be confident they can spring a surprise and go far. They have made it to three World Cup finals in the past, but have yet to lift the coveted trophy as they have fallen at the final hurdle each time. Could this be the time they finally leave that pain behind and go all the way? They navigated their way past hosts Qatar, Ecuador and Senegal in the group stages, finishing top of Group A with seven points from three games. Van Gaal's side then beat the USMNT 3-1 in the last 16 to book their place in the quarter-finals. Here are the 26 players Van Gaal has picked for the tournament proper and how they could line up in the next round against Argentina."
3,Messi's best games for Argentina: From tearing the USMNT apart to salvaging World Cup qualification,GOAL runs through Lionel Messi's most memorable masterclasses...," Lionel Messi is in perhaps his final World Cup, and so far, so good for the Argentina icon. His latest performance - a goalscoring effort in the last 16 against Australia - was one of his most important, though there are certainly many standout efforts over the years to choose from. There may be more to come, too, as Messi will lead Argentina into a quarter-final clash with the Netherlands. GOAL takes a look at some of his best-ever international performances... Check out even more magic Messi moments!"
4,WATCH: Argentina rescued by Emiliano Martinez as Australia almost steal late World Cup equaliser,Argentina needed goalkeeper Emiliano Martinez to make a vital stop at the end of stoppage time to prevent Australia from equalising in the last 16.," WHAT HAPPENED? Australia had a chance to equalise against Argentina in the last minute of stoppage time of their last 16 clash. The ball came to substitute Garang Kuol in the penalty area, and he only had Martinez to beat. However, the Argentina goalkeeper managed to spread himself and make the block, with a vital save that was celebrated by his team-mates. That ending 🤯Australia had a golden chance to force extra time in the 97th minute but Emi Martinez pulls off a crucial save to secure the victory for Argentina 🙅‍♂️#BBCFootball #BBCWorldCup pic.twitter.com/Ytag07HT5u *exhale* - all of Argentina 😅 pic.twitter.com/3W8nCdK4up THE BIGGER PICTURE: Argentina had dominated the match but Australia got back in it when Craig Goodwin's strike deflected off Enzo Fernandez and made it 2-1 with a little over 10 minutes to go. Another goal would have sent the game into extra-time but the Socceroos couldn't find a way past Martinez. WHAT NEXT FOR ARGENTINA? La Albiceleste go on to play the Netherlands in the quarter-finals. Which was the best World Cup winning team? Which was the best World Cup winning team?"
5,"World Cup 2022 groups, fixture schedule, results, knockout stage & everything you need to know",We've got everything you need to know about Qatar 2022 all in one place to ensure you don't miss a thing!," It's World Cup time! After a four-year wait, the best national teams in the world are battling it out again to determine who lifts the coveted trophy after the final on December 18. At Russia 2018, France claimed World Cup glory, with Didier Deschamps - who also won the tournament as a player - seeing his side defeat Croatia 4-2 in the final. Can the French retain their crown or is it finally Lionel Messi or Cristiano Ronaldo's turn to add a World Cup to their enviable list of honours? How about a Neymar-inspired Brazil to come out on top? Eternal favourites Germany and Spain will surely fancy their chances too. The talent - and fashion - on show in Qatar is simply outrageous and it promises to be yet another phenomenal tournament, but what does each team's schedule look like and where do they sit in the standings? We've got you covered with all the info you need to stay right on top of everything in Qatar!"
6,'I feel good' - Neymar offers positive injury update ahead of Brazil's World Cup clash against South Korea,The Brazilian is in a positive mood as he recovers from an ankle injury ahead of Brazil's last-16 World Cup showdown with South Korea.," WHAT HAPPENED? Brazil are still sweating on Neymar's fitness ahead of their knockout tie against South Korea after the Paris Saint-Germain forward sustained an ankle injury in his team's opening win against Serbia. Neymar has missed Brazil's last two matches but seems to be in positive mood ahead of the last 16 match. THE BIGGER PICTURE: Brazil will obviously want to have their talisman back as soon as possible. Tite does not lack for quality forwards in his star-studded squad, although he has seen Gabriel Jesus ruled out of the tournament with a knee problem. WHAT NEXT FOR NEYMAR? Brazil take on South Korea on Monday but it's still not clear if Neymar will be able to feature or if he'll have to watch from the sidelines again. Which was the best World Cup winning team? Which was the best World Cup winning team?"
7,"World Cup 2022 top scorer: Valencia, Mbappe, Gakpo and Messi lead the way in race for Golden Boot",GOAL brings you all the leading goal-getters from the ongoing World Cup - who will come out on top?," The highly-contested World Cup 2022 Golden Boot race is in full flow, with some of the game's deadliest goal-scorers taking their poaching talents to the biggest stage.  Harry Kane scooped up the Golden Boot at the 2018 World Cup in Russia, but who will take home the coveted prize this time around?  Kane, for one, remains a strong favourite to win the Golden Boot for the second tournament in a row - something no one has ever done – but he'll have no shortage of competition, with the likes of Cristiano Ronaldo, Lionel Messi, Robert Lewandowski, Neymar, Memphis Depay, Mehdi Taremi, Enner Valencia, among others, staking their claims for the award.  With goals expected to rain heavily at the World Cup, GOAL is on hand to monitor the race for the World Cup Golden Boot!"
8,Virgil van Dijk tells Netherlands team-mate Cody Gakpo that Man Utd are not on the same level as Real Madrid,"Virgil van Dijk weighed in on the Cody Gakpo transfer rumours, urging his Netherlands team-mate to snub a move to Manchester United for Real Madrid."," WHAT HAPPENED? Speaking after the Oranje's 3-1 victory over the USMNT on Saturday, Van Dijk claimed that the Spanish club are on a much higher level than their Manchester rivals. The centre-back was full of praise for the young forward, arguing that a move to Madrid could be the logical ""next step"" in his career. WHAT THEY SAID: “Are Manchester United and Real Madrid on the same level? No disrespect, not at all,"" Van Dijk said. ""I definitely think he has that next step in him. I definitely feel like it could happen, whether that is in the winter or the summer or next year, time will tell. He is a great boy who works hard, very talented and definitely there is more in him. We are so pleased he is doing so well for us. Long may it continue.” THE BIGGER PICTURE: While Gakpo didn't get on the scoresheet against the US, his three goals in Qatar alongside his 12 goals and 16 assists in all competitions for PSV in 2022-23 have made him one of the hottest properties in Europe right now. While PSV director Marcel Brands ruled out a January transfer, the 23-year-old is set to have a host of potential suitors if he decides to move on in the summer. IN THREE PHOTOS: WHAT NEXT FOR GAKPO? The PSV star is set to feature once again for Louis van Gaal's side in their quarter-final matchup next Friday."
9,WATCH: Ryan howler gifts Julian Alvarez goal for Argentina against Australia at World Cup 2022,Australia goalkeeper Mathew Ryan was guilty of a poor mistake which allowed Julian Alvarez to extend Argentina's lead in the last 16.," WHAT HAPPENED? Australia goalkeeper Ryan was guilty of a mistake as took a heavy touch from a back pass which allowed Alvarez to nick possession and fire the ball into an empty net to make it 2-0 to Argentina. It was a crucial error, as it gave Argentina a needed cushion with Australia pulling a late goal back in an eventual 2-1 result. That is a howler from Matt Ryan 🙈It's an absolute gift for Julian Alvarez who pounces on the Australia keeper's error to double Argentina's lead 😬#BBCFootball #BBCWorldCup pic.twitter.com/RAt1BYVEPt The pressure from Argentina was too much for Australia 😳 pic.twitter.com/t73XO5fopL THE BIGGER PICTURE: Alvarez's goal left Australia with a mountain to climb. Argentina had gone ahead through Lionel Messi's first World Cup knockout goal and had dominated proceedings. Alvarez's second just before the hour mark put Lionel Scaloni's side in charge of the game, and while Australia did score late, it was merely a consolation.  WHAT NEXT? Argentina go on to face the Netherlands in the quarter-finals. Which was the best World Cup winning team? Which was the best World Cup winning team?"
10,Cristiano Ronaldo vs Lionel Messi: Who is better and is the GOAT in football? The stats head-to-head showdown,"A serious discussion point on five-a-side pitches and barstools across the world, the issue of which player is the greatest of all time persists"," Cristiano Ronaldo versus Lionel Messi - who is the GOAT? It is the biggest conundrum in football since the 'Diego Maradona or Pele?' debate. The question of who is better between the Portuguese phenomenon and the empyrean Argentine has dominated the minds of football fans everywhere for the past decade and will persist into the future. Club and national loyalties can cloud judgement on the matter, while personalities also play a part in how good a player is perceived to be, and most people know who they'd pick. So who really is the greatest of all time? Never mind who you prefer, GOAL has taken a look at how the pair actually shape up head-to-head so you can be fully armed with facts in the eternal argument.  On this page Cristiano Ronaldo vs Lionel Messi: Club goals Ronaldo has scored more club goals than Messi, but only just and it should be noted that the Manchester United star benefits from having played two more seasons than his Argentine nemesis thus far. Each of them has remarkably netted over 690 club goals in their career so far, with the five seasons between 2009-10 and 2014-15 proving particularly golden as they pushed each other to greater heights. While Ronaldo currently has more goals overall, Messi has the edge in the scoring department, with a higher season average (37.9 to 35), having hit a high of 73 goals in 2011-12, though his average dropped after a disappointing maiden campaign at PSG in 2021-22. Ronaldo's highest season return was 61, which he achieved in 2014-15, and he surpassed the 50-goal mark every season for six years between 2010-11 and 2015-16. Interestingly, while Ronaldo's seasonal totals have declined somewhat in recent years - he failed to break the 30-goal mark in 2018-19 during his first season at Juventus - Messi's have remained consistent, though the Argentine's rate slowed after joining PSG. Cristiano Ronaldo vs Lionel Messi: Club assists (Opta) When it comes to assists, Messi is much superior to Ronaldo and that contrast has become increasingly stark as their respective roles evolve. The fact that Messi creates so many goals as well as scoring them is a major consideration when deciding which player is the GOAT and, while Ronaldo chips in with his fair share, the difference in this particular realm is stark. Cristiano Ronaldo vs Lionel Messi: Champions League stats *As of Champions League games played in 2022-23. Ronaldo is the all-time leading goalscorer in the Champions League, having shone in the competition with Manchester United and Real Madrid in particular. However, Messi isn't far behind and actually has a fractionally better goal-per-game ratio, so there is a good chance that he could overtake the Man United man if he continues to sparkle in the competition . Ronaldo also holds the record for most overall Champions League appearances, having overtaken Iker Casillas. Cristiano Ronaldo vs Lionel Messi: World Cup stats When it comes to World Cups, Ronaldo and Messi are considered underperformers due to the simple fact that neither has won the competition. Portugal star Ronaldo has scored more goals at the tournament and in fewer appearances, but Messi can claim to have gone furthest, having reached the final with Argentina in 2014. The PSG attacker won the Golden Ball during that tournament, despite missing out on the ultimate glory at the hands of Germany. The furthest Ronaldo reached with Portugal was the Selecao's run to the semi-final in 2006, when they were beaten by France before losing the third-place play-off against Germany. Cristiano Ronaldo vs Lionel Messi: International stats Ronaldo and Messi have similar records at international level, though Ronaldo boasts greater numbers, partly because his senior Portugal career kicked off two years before Messi's with Argentina. Ronaldo equalled Ali Daei's record of 109 international goals at Euro 2020 and then surpassed it with two goals against the Republic of Ireland, becoming the top international goalscorer of all time. Messi is a long way behind Ronaldo in that respect, though he is by some distance Argentina's top goalscorer of all time, surpassing the great Gabriel Batistuta some years ago. Cristiano Ronaldo vs Lionel Messi: Titles    *National Cups refers to the main national cup competition in a country only, e.g. the FA Cup, Copa del Rey etc. Messi and Ronaldo have very similar trophy hauls, but Messi edges things when it comes to league titles, having won La Liga 10 times with Barcelona. Ronaldo has seven league titles, but unlike Messi, he can claim to have won the league in three different countries (England, Spain and Italy) - something that increases his claim to the GOAT crown in the eyes of some. Ronaldo has an edge over Messi in the Champions League, his love affair with the competition earning him the moniker 'Mr Champions League'. The Manchester United star has also enjoyed notable success on the international stage with Portugal, winning the European Championship and the UEFA Nations League. Messi, on the other hand, has endured considerable heartache with Argentina, with four unsuccessful Copa America campaigns, three of which saw them lose in the final. He finally got his hands on the Copa in 2021, before going to win the 2022 Finalissima. While neither has won the World Cup, Messi has an Olympic gold medal. Cristiano Ronaldo vs Lionel Messi: Individual awards The individual battle between Ronaldo and Messi has been the defining feature of modern football for the past decade and more. Messi went ahead of Ronaldo in the Ballon d'Or stakes when he won his sixth in 2019 and cemented his superior status in that field with his seventh in 2021. Ronaldo does boast more of FIFA's new 'The Best' awards and has been crowned UEFA Player of the Year on more occasions, but Messi has won more league Player of the Year accolades. Of course, it must be said that Ronaldo has won the Player of the Year award in England, Spain and Italy. Messi has got his hands on the European Golden Shoe a record six times, which is two more than Ronaldo, and is marginally ahead of his rival overall, but the fact that both have been on the FIFPro World XI 14 times is an illustration of how closely fought the battle has been. Which was the best World Cup winning team? Which was the best World Cup winning team?"
11,"How many goals has Lionel Messi scored for Argentina? Albiceleste star's full World Cup, Copa America and international friendly record",The Argentine has been banging in the goals for his country ever since opening his account in 2005," Lionel Messi is not just one of the best creators of chances around in the game, but he is lethal in front of goal himself as well. The Paris Saint-Germain star is Argentina's all-time leading goal scorer by some distance and holds numerous other goalscoring records, both at club and international level. For the national team, it all started with a tumultuous debut appearance against Hungary in 2005, with Messi receiving a red card barely a minute after coming off the bench. That was merely a blip on his journey to greatness, though, and the forward got his first Argentina goal at senior level in a 3-2 friendly loss against Croatia the following year. That turned out to be start of an impressive goalscoring run and Messi has since been able to celebrate goals more or less wherever he went. Just how many strikes does the Barcelona legend have to his name, though, and in which competitions did he find the net the most often? Lionel Messi's total Argentina goals Competition Games Goals World Cup 23 9 Copa America 34 13 World Cup qualification 60 28 Finalissima 1 0 International friendlies 51 44  169 94 How many goals has Lionel Messi scored at the World Cup? Edition Games Goals 2006 World Cup 3 1 2010 World Cup 5 0 2014 World Cup 7 4 2018 World Cup 4 1 2022 World Cup 4  23 9 Lionel Messi's Copa America record Edition Games Goals Copa America 2007 6 2 Copa America 2011 4 0 Copa America 2015 6 1 Copa America Centenario 2016 5 5 Copa America 2019 6 1 Copa America 2021 7 4  34 13 World Cup qualification goals Edition Goals 2010 World Cup qualifiers 4 2014 World Cup qualifiers 10 2018 World Cup qualifiers 7 2022 World Cup qualifiers 7  28 Messi in the Finalissima Edition Fixture Goals 2022 Italy 0-3 Argentina 0 Messi's friendly goals for Argentina Games Goals 51 44 Messi Argentina hat-tricks Match Goals Competition Date Switzerland 1-3 Argentina 3 Friendly February 29, 2012 Brazil 3-4 Argentina 3 Friendly June 9, 2012 Argentina 4-0 Guatemala 3 Friendly June 14, 2013 Argentina 5-0 Panama 3 Copa America Centenario June 10, 2016 Ecuador 1-3 Argentina 3 World Cup qualifiers October 10, 2017 Argentina 4-0 Haiti 3 Friendly May 29, 2018 Argentina 3-0 Bolivia 3 World Cup qualifiers September 9, 2021 Argentina 5-0 Estonia 5 Friendly June 5, 2022 Messi's favourite opponents Team Goals Bolivia 8 Ecuador 6 Uruguay 6 Brazil 5 Chile 5 Estonia 5 Paraguay 5 Venezuela 5 Colombia 3 Guatemala 3 Haiti 3 Nigeria 3 Panama 3 Switzerland 3 *Data accurate as of December 4 Which was the best World Cup winning team? Which was the best World Cup winning team?"
12,How many goals has Lionel Messi scored during his career? PSG star's jaw-dropping stats in full,"Lionel Messi has bagged an enormous amount of goals for his club and country, but just how many times in total has he found the net?"," Lionel Messi is undoubtedly one of the best players the world has ever seen. There. We said it. But how about Cristiano Ronaldo? Yes, of course, also one of the greatest ever. Just look at their stunning all-time career stats. It's something else. Let's stick to Messi for now, though.  The current PSG star is not just one of the best players overall, but also one of the most lethal goal scorers. He is Barcelona's all-time top goal scorer for a reason. He is LaLiga's all-time top goalscorer for a reason. He is the record holder for goals scored in a single calendar year for a reason. But how many goals has Messi scored in total during his outrageous career at Barcelona, PSG, and Argentina? Let’s take a look!"
13,"Who is Argentina's leading all-time top goal scorer? Messi, Batistuta, Crespo and the Albiceleste's most lethal strikers",The Albiceleste goalscoring chart features an illustrious roll-call of some of the best players to have represented the national team," Argentina are not just arguably one of the most feared national sides around in the game, but they have also produced some of the greatest attackers ever. Diego Maradona doesn't need any introduction. Neither does Lionel Messi. But there have been many more attacking greats representing the Albiceleste. Just think Mario Kempes, the hero of the 1978 World Cup. Or Gabriel Batistuta, one of Serie A's greatest-ever strikers. Who is Argentina's most lethal attacker ever, though? Let's take a look at the men leading their all-time goalscoring charts!"
14,'We wanted it so bad' - Christian Pulisic apologizes to USMNT fans after World Cup elimination,Christian Pulisic expressed disappointment at the U.S. men's national team's World Cup exit and said sorry to supporters.," WHAT HAPPENED? Pulisic was back in the starting XI after injury for the USMNT against the Netherlands at World Cup 2022 on Saturday but couldn't prevent his team being knocked out of the tournament. Louis van Gaal's side won 3-1 to progress to the quarter-finals, while the USMNT must now head home after another last-16 exit. WHAT THEY SAID: ""We’re sorry. We wanted it so bad and I hope that we gave you some kind of excitement and showed you a little bit of what this team is about, and thank you guys,"" he said. ""It hurts a lot right now. We thought we could advance and do a lot more this time around but I love these guys and we did a lot. It was an incredible experience, one I’ll always remember. It hurts right now but give it a couple of days and we can look back and be proud.” THE BIGGER PICTURE: The USMNT has now been eliminated from four of its five appearances in the round of 16 but will have reasons for optimism. Gregg Berhalter's squad is packed full of young talent with players such as Weston McKennie, Gio Reyna and Sergino Dest around. The team will also be well aware that the 2026 World Cup will be hosted in the United States, Mexico and Canada.  IN THREE PHOTOS:  DID YOU KNOW? Pulisic was directly involved in all three of the USMNT's goals at the 2022 World Cup (one goal, two assists).  WHAT NEXT FOR PULISIC? The forward will now switch focus back to Chelsea. The Blues return to Premier League action on December 27 against Bournemouth. Which was the best World Cup winning team? Which was the best World Cup winning team?"
