,title,description,article_text
155,'That man will never set foot in Perugia again!' - Ahn Jung-hwan & the golden goal that ruined Italian football,South Korea coach Guus Hiddink told the striker before the 2002 World Cup that the tournament would change his life - and it did.," Ahn Jung-hwan endured a traumatic childhood. Raised by his grandmother after the loss of both of his parents, he never had much growing up. He only started playing football as a kid because his local club offered their players bread and milk. It's perhaps unsurprising, then, that even after turning professional, his post-retirement goals were modest. ""I hope I will be running a small grocery store,"" he revealed, ""and just living in comfort."" Happily, Jung-hwan is doing quite well for himself, albeit not as a green-grocer. He has instead established himself as one of the most famous broadcasters in South Korea. He even has his own YouTube channel. And his success is rooted in one of the most famous goals, in one of the most infamous matches, in World Cup history. An entire book could be written about South Korea's meeting with Italy in Daejeon in 2002. In Italy, the referee, Byron Moreno, remains renowned as one of the biggest villains in football history. Jung-hwan, meanwhile, is remembered for his Golden Goal – and the pathetic reaction it provoked from his employer, Perugia president Luciano Gaucci. At the time, the striker was coming off two underwhelming seasons in Serie A, which had featured just five goals in 30 appearances. His confidence was low and he had actually begun the World Cup sitting on the bench. However, South Korea boss Guus Hiddink retained the utmost faith in Jung-hwan. He told him that the tournament would change his life – and it did. He came off the bench to score in the group-stage clash with USA, earning his nation a precious point and himself a place in the starting line-up. His most significant contribution, though, would come against his adopted home.  Jung-hwan later confessed that he felt Italy had no chance against a star-studded Italy. However, the last-16 showdown united Korea like no other match, before or since. The Taeguek Warriors even received support from their neighbours to the north, while the fans that descended upon Daejeon on June 18, 2002 revelled in reminding the Azzurri of one of their most humiliating World Cup defeats. 'Again 1966' was the message from the stands, a reference to Italy's loss to North Korea at Goodison Park 38 years previously. Jung-hwan should have opened the scoring, too, but his early penalty was saved by Gigi Buffon. So, when Christian Vieri broke the deadlock, it appeared that a team that also contained Francesco Totti, Alessandro Del Piero and Paolo Maldini would coast to victory. However, Italy's coach, the notoriously pragmatic Giovanni Trapattoni, instead tried to see out the game, and the Azzurri almost inevitably paid the price, with Seol Ki-Hyeon equalising with just two minutes of normal time remaining. By this stage, Moreno's performance – and apparent lack of fitness – was already coming under scrutiny, and it only intensified when Totti was harshly shown a second yellow card for simulation. Then, with just three minutes to go before penalties, the ball was swung into the Azzurri area. There appeared to be only one winner: Maldini, arguably the greatest defender of all time. Jung-wan, though, got the jump on him – literally. He later revealed, ""I actually thought I jumped too early and wouldn't be able to head the ball. But Maldini got his timing wrong because I jumped first. That was a big stroke of luck for me."" There was nothing fortuitous about the finish, though, with Jung-hwan heading home to send Korea into raptures, and Italy into meltdown. Jung-hwan became an instant icon. ""I remember there were so many fans waiting for me that I couldn't go outside,"" he told JoongAng. Indeed, his Golden Goal had generated a wave of euphoria that South Korea rode all the way until the last four. However, in Italy, there was uproar, with many believing Moreno's handling of the game to be evidence of match-fixing. The Gazzetta dello Sport, meanwhile, claimed that this was the latest demonstration of a FIFA-led persecution of the Azzurri. Gaucci, though, focused his frustration on Jung-hwan. ""That man will never set foot in Perugia again,"" he fumed. ""He was a phenomenon only when he played against Italy! ""I am a nationalist and I regard such behaviour not only as an affront to Italian pride but also an offence to a country which two years ago opened its doors to him. ""I have no intention of paying a salary to someone who has ruined Italian football."" The notoriously erratic Gaucci quickly backed down but Jung-hwan was understandably outraged, blaming his boss for creating a toxic atmosphere which he says resulted in his car being vandalised and local news reports of death threats from the mafia. ""It was almost like I had ended my entire football career with that one goal,"" he told JoongAng. Jung-hwan refused to play for Perugia again and what followed was a messy contractual dispute which scuppered his hopes of joining Premier League outfit Blackburn Rovers. In the end, a Japanese firm agreed to pay the €3.8 million (£3.3m/$3.8m) that Gaucci was demanding in compensation, and the forward joined J-League outfit Shimizu S-Pulse. He later acknowledged, ""My life could have been different if I had played in the Premier League, but a lot of people have told me that they were very happy because I was part of the 2002 squad, and I always tell them, no, you made me happy. ""I think that $3.8m is the price I paid for the respect and love I have received from the people."" Jung-hwan, then, has no regrets, and rightly so. The controversy which surrounded South Korea-Italy, and the subsequent fallout, had absolutely nothing to do with him. He did absolutely nothing wrong. As he said himself in an interview with FIFA+, ""There's no law stating I'm not allowed to score against Italy. When I look back, I would swap my whole career for that one goal."" The header that made him a national hero. Which was the best World Cup winning team? Which was the best World Cup winning team?"
156,"Japan World Cup 2022 squad, predicted line-up versus Croatia and star players",Japan have surprised many by topping the so-called group of death to reach the last 16. But who is in Hajime Moriyasu's squad?," Japan have been turning heads at the World Cup with their performances on the pitch. They have beaten two former World champions in Germany and Spain respectively and have finished on top of Group E to progress to the knockouts. Their best-ever performance at the World Cup has been reaching the round of 16 on three different occasions, and they will be looking to surprise football fans around the world in the 2022 edition by going one step further, at what will be the team's seventh consecutive appearance at the tournament. Coach Moriyasu will have breathed a sigh of relief that his team sealed a place in Qatar at all following a rocky start to their qualification campaign, with Japan eventually finishing second in their group behind Saudi Arabia despite losing two of their opening three games. Another tough challenge now awaits, as they are set to go up against 2018 World Cup runners-up Croatia on Monday. ALSO READ: World Cup 2022 Group E: Fixtures, results, standings, squads & full details"
157,Canada star Jonathan David reacts to Man Utd transfer rumours & offers hope to Premier League suitors,"Jonathan David claims to be unaware of rumours linking him with Manchester United, but the Canada international is a big fan of the Premier League."," WHAT HAPPENED? There is plenty of speculation to suggest that the talented 22-year-old could soon be heading to England, with his potential having been noted by leading sides across Europe. David is currently catching the eye in France with Lille, while he helped his country to the 2022 World Cup finals in Qatar, with 41 goals recorded through 111 appearances for his Ligue 1 employers. WHAT THEY SAID: Those exploits are said to have attracted interest from Old Trafford, but David has said when quizzed on links to United: “I am aware of nothing. When I am at the World Cup I am just focused on trying to enjoy the World Cup and enjoying the moment. What happens after I do not know, we will have to see. The Premier League is the best league in the world and I think every player would want to play there some day.” THE BIGGER PICTURE: David’s admiration of the English top-flight could benefit his many suitors in that part of the world, with big-money bids having been mooted for some time now – with north London rivals Arsenal and Tottenham also said to be keen on the highly-rated forward. IN TWO PHOTOS:   WHAT NEXT? David’s World Cup adventure with Canada – their first since 1986 – has come to a close, with three defeats in Group F seeing them bow out without picking up a point, although Bayern Munich star Alphonso Davies did record his nation’s first goal at FIFA’s showpiece event. Who will progress to the FIFA World Cup quarter-finals? Who will progress to the FIFA World Cup quarter-finals?"
158,Quiz! Name all of Uruguay star Luis Suarez's former clubs,"Luis Suarez is surely featuring at his final World Cup, but he's played for some of the biggest clubs on the planet during his storied career."," Luis Suarez and Uruguay haven't had it all their way at this World Cup and they enter today's crunch clash with Ghana knowing that only a win will do if they are to qualify. Suarez may not start against the Black Stars, but you can be sure that the camera will be spending plenty of time on him. Not only is he the biggest name on display, his handball back in 2010 effectively prevented Ghana becoming the first African team in World Cup history to reach the semi-finals. Ouch. The incident is one of many controversies Suarez has been embroiled in on and off the pitch, but there's no doubting his talent. The question is, can you remember all the illustrious clubs he's played for? Which was the best World Cup winning team? Which was the best World Cup winning team?"
159,"Ultimate South Korea dream team - Son & Park in, Lee Chun-soo out",Some immensely talented players have represented South Korea on the global stage and this is their greatest-ever XI!," South Korea are arguably the most successful Asian team at the global stage. The 'Taegeuk Warriors' have participated in nine consecutive World Cup tournaments - and 10 in total in history, more than any other Asian country. They became the first and only Asian team to date to reach the semi-finals of a World Cup when they achieved that feat on home soil in 2002, eventually losing to Germany. The two-time AFC Asian Cup winners have fielded some of the best players on the continent over the years, with the likes of Park Ji-sung and Son Heung-min absolute global superstars in their prime But who make it into their best-ever XI?"
160,"Spain World Cup 2022 squad, predicted lineup vs Morocco and star players",Who will Spain boss Luis Enrique call on for La Roja's round of 16 clash with Morocco?," Spain's hope of achieving World Cup glory for the first time since 2010 are still alive, despite falling to a second-place finish in Group E. A frantic group stage campaign saw La Roja start strong, but gradually show their mortality. A rampant win over Costa Rica was followed up by a draw against Germany and a shock defeat to surprise package Japan - who secured top spot in the group with another huge win. Despite the streaky performances, Luis Enrique has a good record with the Spanish national team and an excellent talent pool to pick from. Here's what to know as Spain approach the last 16:"
161,"Croatia World Cup 2022 squad, predicted line-up versus Japan and star players",Who will Zlatko Dalic pick in his starting XI against Japan in the round of 16? ," 2018 World Cup finalists Croatia will hope to go one step further as they continue their 2022 campaign in the last 16 against Japan. Having missed out on the trophy last time around, star midfielder and captain Luka Modric will be hoping to come back home with the iconic trophy this time around. Having graduated from a group consisting of Belgium, Morocco and Canada, they are set to take on Japan in the next round of the tournament on December 5. Zlatko Dalic's squad feature familiar faces such as Modric, Andrej Kramaric, Ivan Perisic and Mateo Kovacic. Let see how many of those players will make the starting XI up when they come up against Japan in the first knockout round of the competition.  ALSO READ: World Cup 2022 Group F: Fixtures, results, standings, squads & full details"
162,"Musiala doesn't deserve it to end like this! Germany winners, losers & ratings as it's yet ANOTHER World Cup failure - and don't mention the VAR","There was huge drama in Group E as a controversial VAR call sent Japan through, while Germany were knocked out at the group stages yet again."," It was too little, too late for Germany as they crashed out of the World Cup despite beating Costa Rica 4-2 on Thursday night.  Hansi Flick's team were dominant from the beginning of the match as they chased the vital victory they needed to surely put them through. They did their bit and got the three points but with Japan incredibly beating Spain it wasn't enough. The tension was evident. Germany buckled initially as Costa Rica found a way back into the game, with Manuel Neuer and Antonio Rudiger producing moments of madness to allow their opponents to take a shock lead. Serge Gnabry and Kai Havertz were there to rescue Flick's side, however, with the Bayern Munich winger chipping in with the opening goal and a vital assist, while the Chelsea forward came off the bench to score twice.  Having lost to Japan, drawn with Spain and then allowed Costa Rica to give them a real scare in what should have been an easy win going by the first-half performance, few would argue that Germany really deserved a place in the next round of the tournament. They were simply too inconsistent and sloppy in the key moments in this competition and although they may turn their anger towards VAR following a controversial call in the clash between Spain and Japan, they must first acknowledge their own shortcomings in Qatar."
163,'Annoyed' Luis Enrique admits Japan 'deserved' to win World Cup group after defeating Spain,Spain coach Luis Enrique says Japan deserved to finish first in their World Cup group after the Asian nation beat his team 2-1 on Thursday.," WHAT HAPPENED? Japan came from a goal down to win their final match of the round to book their place in the last 16 of the competition. Hajime Moriyasu's team turned the match around with two goals in quick succession as Ritsu Doan equalised three minutes after the restart and then Ao Tanaka put his team ahead shortly afterwards. The result ensures Japan go through as Group E winners and Spain go into the knockout rounds as runners-up. WHAT THEY SAID: ""There were five minutes of panic. They scored two goals against us and could have scored another two,"" Luis Enrique said to La1. ""When a team like Japan has nothing to lose, it happens that they fly like airplanes. Then it went back to normal. The end was already very difficult, because they were very closed. Japan goes first and it is deserved. It annoys me. I wanted to be first."" THE BIGGER PICTURE: VAR played a vital intervention for Japan as their second goal was the subject of a lengthy review as it was thought the ball may have gone out of play in the build up. It was eventually decided that the whole ball had not crossed the line, though, and the goal stood. That ensured Japan went through and Germany, finishing third in the group on goal difference, went out. IN THREE PHOTOS:   DID YOU KNOW? Spain have lost their final group stage game at the World Cup for the first time since 1982, when they lost 1-0 to Northern Ireland. They won eight of their previous nine such games before losing to Japan. WHAT NEXT FOR SPAIN? Luis Enrique's team will meet Morocco in the next round of the tournament on December 6, while Japan will take on Croatia in the last 16. Which was the best World Cup winning team? Which was the best World Cup winning team?"
164,Thomas Muller hints at international retirement after Germany crash out of World Cup again,Thomas Muller hinted at the possibility of retiring from international football after Germany were eliminated from the World Cup on Thursday.," WHAT HAPPENED? In a chaotic night of World Cup action in Qatar, Group E's table took shape and saw Japan advance as group winners with Spain the runners up. Germany crashed out of the tournament despite fighting back against Costa Rica and claiming an eventual 4-2 win. After the game, Muller suggested that he might close the curtain on his international career. WHAT HE SAID: ""If that was my last game for Germany, a few words to the German fans: It was a tremendous pleasure,"" he said to reporters after the win. ""Thank you very much. I always tried to show heart on the pitch. Sometimes there were tears of joy, sometimes pain. ""I did it with love. I need to think about everything else now."" THE BIGGER PICTURE: Germany have now exited the World Cup in the group stages in back-to-back tournaments after winning the tournament in 2014. Muller was excluded from the national team from 2019 to 2021 under Joachim Lowe, but now could be set to call time on his own terms after yet more disappointment. IN THREE PHOTOS: WHAT NEXT FOR MULLER? If that is the end of his career on the international stage, the 33-year-old walks away a World Cup winner with 44 goals in 121 caps for Germany. But, Muller still has plenty to offer at club level, and will now turn his attentions back towards Bayern Munich. Which was the best World Cup winning team? Which was the best World Cup winning team?"
165,Tiki-Taka breakers! Japan defeat Spain with just 17.7% possession to set World Cup record,"Japan beat Spain 2-1 with only 17.7% possession on Thursday, setting a new World Cup record for a winning team since that data has been tracked."," WHAT HAPPENED? Japan executed their counter-attacking plan to perfection and scored twice despite barely touching the ball. They have now qualified to the last 16, along with Spain, at the expense of Germany and Costa Rica. With 17.7% of the ball, Japan have won a World Cup game with the lowest possession figure in recorded WC history.#FIFAWorldCup pic.twitter.com/WTu4v4bTTd THE BIGGER PICTURE: The Spanish national team have long been a side that thrives with the ball at their feet thanks to their possession-based style, but Japan showed an excellent game plan to counter that approach. WHAT NEXT FOR JAPAN?: After unexpectedly finishing top of Group E, Japan will face Croatia in the round of 16. Which was the best World Cup winning team? Which was the best World Cup winning team?"
166,"Wow... just wow! Spain winners, losers & ratings as La Roja ride their luck to set up Morocco last-16 showdown on a night that belonged to Japan","Spain lost 2-1 to Japan despite leading at half-time but still made it through in second place, setting up a last-16 tie with Morocco"," Football is never as simple as it looks. In a World Cup group containing two former winners of the illustrious prize, alongside two nations who are largely considered minnows in the game, the very real possibility that the two former winners could go out was simply incomprehensible. But alas, that reality came to be. At least for a while. Spain strolled into half-time with a 1-0 lead and looked comfortable. However, a rally from Japan saw them burst into a 2-1 lead after the break thanks to the iconic Ritsu Doan and a rather controversial strike from Ao Tanaka. Fair or not, Japan had a lead against the 2010 world champions, having already beaten the 2014 champions in Qatar. And with Germany stuttering against Costa Rica elsewhere in Group E, there was a (very) brief moment where both Japan and Costa Rica were advancing at the expense of Spain and Germany. Kai Havertz fired in for 2-2 to ensure that didn't happen, which ultimately spared Spain's blushes as it ensured they progressed to the knockout stages, albeit in second place. Germany would end up winning 4-2, but needed a favour that never came from the Spaniards in order to progress themselves. La Roja couldn't find a way through and fell into their old, toothless ways against a Japan outfit that you can't help but love, sending Germany out of the World Cup in doing so. Here are GOAL's winners and losers as Spain stutter into the last 16."
167,"World Cup 2022 Group E: Fixtures, results, standings, squads & full details",Everything you need to know about the group that includes former champions Spain and Germany," Group E of the 2022 World Cup featured former world champions Germany and Spain alongside Costa Rica and Japan. Japan punched way above their weight in a group where they shouldn't even have qualified on paper. They not only qualified for the Round of 16, but also topped Group E in a group consisting of Spain and Germany, both of which the Samurai Blue defeated. Japan will take on 2018 runners-up Croatia in the Round of 16. Spain are always one of the favourites heading into a World Cup, with their 7-0 win over Costa Rica in their opening group game further rubber-stamping their credentials. However, they lost momentum into the next two games, drawing 1-1 against Germany and falling to a shock 2-1 defeat to Japan in the final group game to finish runners-up in Group E to set up a clash against Morocco in the Round of 16. Germany were the other victim of the Japanese efficiency, falling to a 2-1 defeat in the opening group game and leaving them with a mountain to climb. In the final group game against Costa Rica, Hansi Flick's side were leading 1-0 at half-time, with Spain also leading Japan by the same scoreline simultaneously. Germany were progressing to the Round of 16 as things stood, However, an inspiring second half comeback from Japan meant that Germany crashed out of the group stage of a World Cup for the second successive time, even if they managed a 4-2 win. Costa Rica's hammering at the hands of Spain meant that they needed two wins out of two to progress to the Round of 16. They did manage to beat table toppers Japan 2-1 in their next game. The Costa Ricans were also leading Germany 2-1 at the 70th minute in their final group game, taking them to second place in the group as things stood then. However, Die Mannschaft scored 3 goals in the last 20 mins to end Costa Rica's hopes."
168,Explained: Why Japan's second goal against Spain was controversially allowed by VAR despite ball appearing to be out of play,"Japan's second goal against Spain, scored by Ao Tanaka, was allowed to stand after a lengthy VAR check - here's why."," WHAT HAPPENED? Tanaka slotted home past Unai Simon following Kaoru Mitoma's cross but the ball appeared to be out of play. After a lengthy VAR check, referee Victor Gomes was eventually instructed to award the goal which ultimately resulted in a 2-1 victory for Japan. Germany, who finished third in the group, would have qualified for the knockout stages had Tanaka's goal been chalked off and the game finished as a draw. In the blink of an eye, Japan turn things around! 🫣Did it cross the line though...? 👀#ITVFootball | #FIFAWorldCup pic.twitter.com/Y8C5FdBSVK After a VAR check this was confirmed as a goal for Japan 🇯🇵 pic.twitter.com/WDmJ1QJAdc WHY WAS IT GIVEN? It was initially difficult to determine how exactly VAR reached the conclusion that the goal should be allowed, with global TV broadcasters displaying images that appeared to show the ball was out of play. However, alternative angles that haven't yet been released by FIFA led to the VAR team concluding that the whole ball hadn't actually gone out, and was overhanging the line. Indeed, despite the officials being adamant that they made the right decision, it is undoubtedly one of the most marginal calls of the World Cup so far that will continue to be debated for a long time yet. STORY IN A PHOTO: Top down and in play by the smallest of margins. pic.twitter.com/JGKeIt7DtS WHAT'S NEXT FOR JAPAN: The goal set up a dramatic 2-1 win that saw Japan advance to the knockout stages, where they will face Croatia, with Spain also advancing, with La Roja paired with Morocco in the last 16. Which was the best World Cup winning team? Which was the best World Cup winning team?"
169,WATCH: Roberto Martinez appears to moonwalk out of interview after stepping down as Belgium boss,Roberto Martinez seemed to moonwalk away from his TV interview after announcing his departure from Belgium. ," WHAT HAPPENED? Roberto Martinez seemed moonwalk away from the TV cameras following his announcement that he would be stepping down as Belgium manager. The Red Devils failed to qualify from Group F following their 0-0 draw with Croatia. Did Roberto Martinez just moonwalk out of the job pic.twitter.com/oTasPCki7n THE BIGGER PICTURE: Belgium's elimination will mean an overhaul of their national team, with older stars likely to follow Martinez to the exit. WHAT NEXT FOR MARTINEZ? Martinez is now on the job market, and will be linked to club jobs that open up mid-season. It's unclear what his personal plans are as he has also worked as a pundit. Which was the best World Cup winning team? Which was the best World Cup winning team?"
