,title,description,article_text
91,WATCH: Aboubakar gets red card for taking off shirt in celebration after heading Cameroon to World Cup win against Brazil,Vincent Aboubakar was shown a red card for taking off his shirt as he celebrated his stoppage time goal for Cameroon against Brazil on Friday.," WHAT HAPPENED? Aboubakar met Jerome Ngom Mbekeli's cross with a fantastic header two minutes into stoppage time to fire his side to a 1-0 win against Brazil in the final game of the World Cup group stage. Aboubakar took his jersey off as he and his team-mates went wild and was shown a second yellow card for the offence. The 30-year-old accepted the dismissal and even shook the referee's hand. Vincent Aboubakar! 🙌🇨🇲✅ Get the winner against Brazil in injury time✅ Get a red card for taking your shirt off to celebrate#ITVFootball | #FIFAWorldCup pic.twitter.com/YAkGaNtKqK Aboubakar celebrates his goal for Cameroon by taking off his shirt, and then is sent off for a second yellow card 😅 pic.twitter.com/JubSqTAX1L THE BIGGER PICTURE: Aboubakar and Cameroon were elated to get the better of tournament favourites Brazil at the World Cup but the victory was not enough to send the African nation through to the next round. Switzerland's 3-2 win against Serbia ensures they progress as group runners up. WHAT NEXT FOR BRAZIL? Despite their loss, Brazil finish top of Group G with a better goal difference than Switzerland. They will take on South Korea in the last 16 while Switzerland face Portugal. Which was the best World Cup winning team? Which was the best World Cup winning team?"
92,"World Cup 2022 Group G: Fixtures, results, standings, squads & full details",Everything you need to know about the group that includes five-time champions Brazil," Brazil secured their place in the next round and first place with two narrow wins against Serbia and Switzerland but suffered a shock defeat to Cameroon on the last day. Apart from their defeat to Brazil, Switzerland were otherwise solid and defeated Cameroon and Serbia to clinch 2nd place. Cameroon will be heartbroken to be eliminated from the tournament despite their efforts but will be proud to go back as the first African team to beat Brazil at the World Cup. Serbia showed a lot of heart and grit in their matches but had nothing to show for it apart from a point from their draw against Cameroon."
93,Who are the Netherlands' best players? Key performers to watch in World Cup 2022 knockout rounds,The Oranje have made it to the last 16 - GOAL takes a look at their key players," Netherlands made it out of the 2022 World Cup group stage with flying colours and now hope to lift the coveted trophy for the first time. Louis van Gaal's men more or less breezed past Senegal and hosts Qatar, but they were held to a 1-1 draw by Ecuador. The Dutch now face the USMNT in the round of 16 with the later making it out of Group B as runners-up. GOAL takes a look at the best Netherlands players at the 2022 World Cup."
94,"World Cup 2022 knockout stage: Dates, kick-off times & road to the final","GOAL brings you the date, time and venue of every knockout fixture"," The knockout rounds of the World Cup are where legends are truly made. A total of 16 nations will progress to the next phase of the tournament in December, where every game must have a winner. As is tradition, if 90 minutes are completed with the scores level, proceedings will move to 30 minutes of extra time. If there is still nothing to separate the two teams, a penalty shoot-out will be the decider. World Cup 2022 knockout bracket Success in the World Cup is often dependent on which side of the bracket your nation ends up occupying. This year, the highest-ranking footballing nations are fairly evenly spread. On one side of the tournament tree, in groups A to D, sit the likes of Netherlands, England, Argentina, and France. On the second side, in groups E to H, nations such as Spain, Brazil, Portugal, Japan and Morocco all have the opportunity to play each other before the final. World Cup 2022 last 16 In 2022, the last-16 matches will take place from the December 3 to December 6. World Cup 2022 quarter-finals The quarter-finals of World Cup 2022 will be played on December 9 and 10. World Cup semi-finals World Cup 2022 semi-finals will take place on December 13 and December 14. Games will be played at Lusail Iconic Stadium and Al Bayt Stadium World Cup 2022 third-place play-off The teams that lose in the semi-finals face off for the right to be recorded as third-place in the history books. The 2022 World Cup third-place play-off takes place the day before the final, on December 17. World Cup 2022 final The World Cup 2022 final will be played on December 18 at Lusail Iconic Stadium. It is a Sunday 3pm kick-off in the UK and an early-morning game in the U.S. Which was the best World Cup winning team? Which was the best World Cup winning team?"
95,WATCH: Furious Cavani punches VAR monitor in fit of rage after Uruguay dumped out of World Cup,A video has emerged of Edinson Cavani punching the VAR monitor after Uruguay crashed out of the World Cup group stages despite beating Ghana.," WHAT HAPPENED? Cavani couldn't contain his rage following Uruguay's premature exit from the tournament. As the players walked down the tunnel after the match, the veteran forward angrily punched the VAR monitor, causing it to fall to the ground. THE BIGGER PICTURE: Cavani's furious reaction was an extension of Uruguay's unsavoury behaviour at the full-time whistle, which saw players and coaching staff angrily approach the referee, protesting decisions made in the game.  WHAT NEXT FOR URUGUAY? Victory over Ghana wasn't enough for the Celeste as late drama in Group H's other match saw South Korea beat Portugal 2-1 and progress to the last 16 on goals scored. Uruguay, meanwhile, are making sure they don't go home quietly. Which was the best World Cup winning team? Which was the best World Cup winning team?"
96,Switzerland star Xherdan Shaqiri matches Ronaldo & Messi record with World Cup goal against Serbia,Xherdan Shaqiri joined Lionel Messi and Cristiano Ronaldo in becoming only the third player to score in the last three World Cup tournaments in a row.," WHAT HAPPENED? Shaqiri demonstrated he still possesses a wand of a left foot as he slotted home Switzerland's opener against Serbia, matching football's ultimate GOATs, Lionel Messi and Cristiano Ronaldo, in the process. Xherdan Shaqiri!!! 💪Switzerland take the lead against Serbia 🇨🇭#ITVFootball | #FIFAWorldCup pic.twitter.com/vMRQzOWO9y SHAQIRI SCORES FOR SWITZERLAND 🇨🇭As it stands, Brazil and Switzerland are moving on to the knockout stage! pic.twitter.com/UveYxb5IFW THE BIGGER PICTURE: Having also netted for Switzerland at World Cup 2014, against Honduras, and in 2018, against Serbia, Shaqiri became only the third player to score in each of the last three editions of the World Cup.  WHAT NEXT FOR SHAQIRI? Should Switzerland hold on for the win, Shaqiri and his team-mates can look forward to a last-16 tie against Portugal. Which was the best World Cup winning team? Which was the best World Cup winning team?"
97,Brazil show support for Pele with stunning banners at Cameroon World Cup clash - legend still in hospital,Brazil fans showed their support for Pele by displaying huge banners wishing the football legend well following the news he is back in hospital.," WHAT HAPPENED? The Selecao fans put on a wonderful show of support for the three-time World Cup winner ahead of their group stage match against Cameroon. One of the banners carried the message ""get well soon"". THE BIGGER PICTURE: It was announced earlier this week that the 82-year-old is back in hospital with a heart problem while he continues to undergo chemotherapy after having a tumour removed. WHAT NEXT FOR BRAZIL? The Selecao will be hoping to pay tribute to the iconic former player by going on to win the World Cup. They were already sure of a place in the knockout rounds ahead of their match against Cameroon on Friday. Which was the best World Cup winning team? Which was the best World Cup winning team?"
98,England captain Leah Williamson returns to Arsenal squad for Everton WSL clash following lengthy injury layoff,Leah Williamson is finally back in the Arsenal matchday squad after missing two months of action due to a foot injury. ," WHAT HAPPENED? The England captain has been back in training for some time after picking up a foot injury while on international duty in October, and the Gunners have now confirmed that she is match fit. Williamson could feature against Everton on Saturday, with first-choice defensive partner Raffaella Souza also available for selection after a similarly-long lay-off. THE BIGGER PICTURE: Williamson has missed eight games because of her injury but Arsenal have fared well in her absence, with Lotte Wubben-Moy and Steph Catley deputising admirably. The Gunners have won six of those eight fixtures, a run that includes a 5-1 win away to Lyon,  4-0 win at Leicester and a 3-1 win at home against West Ham.  WHAT THEY SAID?: Speaking about Williamson's long-awaited return, Arsenal coach Jonas Eidevall said: ""It helps us a lot because we get two more players of very high quality into our environment. That will boost any team and it certainly does for us. Leah is very motivated to get back onto the pitch and to help the team achieve things."" IN TWO PHOTOS:     WHAT NEXT FOR WILLIAMSON? While it's unlikely that the defender will start against Everton, she may well play some part in the game. Arsenal will be desperate for a result after tasting their first WSL defeat of the season at the hands of Man Utd last weekend. "
99,"Spain's route to World Cup 2022 final: Knockout stage opponents, dates & where to watch on TV",The 2010 World Cup winners will be looking to recreate their magic on the biggest stage once again!," Spain have won the World Cup just once in their history, but La Roja will be upbeat about their chances in Qatar 2022.  They crashed out in the round of 16 in Russia after being beaten by the hosts on penalties. They went a step further in Euro 2020 and reached the semi-finals before being ousted by eventual champions Italy, once again via spot kicks.  What will Spain need to do to become world champions for the second time? GOAL takes a look at the Spaniards' potential route to the final. Spain's World Cup group stage finish Spain started their World Cup campaign with a historic 7-0 win over Costa Rica. However, they could not keep up their brilliant start as they were held by Germany to a 1-1 draw and then suffered to a 2-1 defeat to Japan on matchday three.  Spain's last-16 opponents Spain have finished runners-up in Group E which means they will face the toppers from Group F. Morocco emerged as group champions in that pool ahead of Croatia, which means Luis Enrique's men will take on the African nation for a place in the quarter-finals of the competition on Tuesday. The game will go ahead on December 6, 2022, at the Education City Stadium, and will kick off at 3pm GMT (10am ET). Spain's possible quarter-final opponents If Spain beat Morocco, they will face Portugal, who won Group H, or the runner-up of Group G (Brazil/Switzerland/Cameroon/Serbia). That quarter-final will take place at 3pm GMT (10am ET) on December 10, at the Al Thumama Stadium. Spain's possible semi-final opponents If Spain make it through to the semi-finals, they will face either England/Senegal or France/Poland. The semi-final will take place on December 14 at 7pm GMT (2pm ET) at the Al Bayt Stadium. Spain's possible World Cup final opponents It's difficult to predict exactly who Spain could face in a potential final but, they will meet a team from the other side of the bracket. Netherlands, United States, Argentina, Australia, Japan and Croatia are all potential opponents. There are also the winners of G or South Korea. The World Cup 2022 final will be played on December 18, 2022. The game kicks off at 3pm GMT (10am ET). Spain's route to the World Cup 2022 final Here are Spain's fixtures on the route to the World Cup 2022 final at a glance. Where to watch Spain World Cup games on TV & stream online BBC and ITV have the broadcast rights for the World Cup in the United Kingdom while FOX and Telemundo are broadcasting games live on TV in the United States. You can check GOAL's Soccer on U.S. TV listings here and the Football on UK TV listings here. How far do you think Spain will go in the World Cup? Let us know in the comments! 👇 Which was the best World Cup winning team? Which was the best World Cup winning team?"
100,Who are the USMNT's best players? Key performers to watch in World Cup 2022 knockout rounds,The Stars and Stripes are into the knockout stage - GOAL takes a look at their key players," The United States men's national team has emerged from Group B and their performances have instilled plenty of belief that they can go even further at World Cup 2022. Gregg Berhalter's side managed to hold England - one of the tournament favourites - to a scoreless draw and showed tremendous nerve to overcome Iran and book their place in the knockout stage. They find themselves in the side of the knockout bracket that contains the Netherlands, who they play in the last 16, Argentina, Croatia and other heavyweights, but have enough quality of their own not to give way to trepidation. GOAL takes a look at the best USMNT players at Qatar 2022."
101,WATCH: Brazil's team bus literally shakes as World Cup favourites dance & jump around before Cameroon match,The Brazil team were in high spirits as they had their bus shaking due to their dancing en route to their World Cup match against Cameroon.," WHAT HAPPENED? The Brazilian Football Confederation (CBF) posted on social media a video of the players dancing and jumping as they travelled to the Lusail Iconic Stadium for their final group stage match against Cameroon. Chegamos, Copa do Mundo FIFA Qatar 2022! Daqui a pouco entramos em campo pra enfrentar Camarões!Vaaaaaaamos! pic.twitter.com/XkODgIKSPh THE BIGGER PICTURE: Brazil have every reason to be excited ahead of the match as they are already sure of a place in the last 16 of the tournament, having beaten Serbia and Switzerland in their opening two matches. A point against Cameroon is enough to ensure they finish as Group G winners. WHAT NEXT FOR BRAZIL? If Brazil take top spot in the group they will go on to meet South Korea in the next round. If they finish second, they will meet Portugal in the round of 16. Which was the best World Cup winning team? Which was the best World Cup winning team?"
102,'I have nothing to celebrate' - Luis Enrique left fuming by Japan defeat despite Spain's World Cup progression,"Spain manager Luis Enrique has said he is not happy after the defeat to Japan, despite Spain's progression to the knockout stages of the World Cup."," WHAT HAPPENED? Spain failed to win Group E thanks to a three-minute second-half turnaround that was completed by a controversial Ao Tanaka goal. The result meant Spain scraped through to the knockout stages ahead of Germany on virtue of goal difference. The performance was a far cry from the one Spain produced in the 7-0 win over Costa Rica, and the coach admitted that his team's collapse left him ""annoyed"".  WHAT THEY SAID: He continued to vent his frustration, saying at a press conference: ""I have nothing to celebrate, I'm not at all happy. I wanted to be first in the group and win this match. I warned the players at half time that Japan would come out on top but we went into collapse mode. I repeat: I have nothing to celebrate."" THE BIGGER PICTURE: Despite his warranted concerns, Spain are through to the knockout stages for the second consecutive World Cup after failing to get out of the group stages in the 2014 edition. Granted, it wasn't as plain-sailing or as comfortable as they would have liked, but the job was done.  IN THREE PHOTOS:    WHAT NEXT FOR SPAIN? They face Morocco, who have been one of the tournament's surprise packages thus far, in the round of 16 as they look to put the disappointment of losing to Japan behind them. A win would see them into the last eight for the first time since their victory in 2010.  Which was the best World Cup winning team? Which was the best World Cup winning team?"
103,Bring on Gakpo! How the USMNT defense became one of the World Cup's meanest,The Netherlands attacker is the breakout star of the World Cup but Gregg Berhalter's brilliant backline is capable of shutting him down on Saturday.," We've all heard the famous saying about an irresistible force meeting an immovable object. And we're all going to see it play out on Saturday at Khalifa International Stadium. That irresistible force is one Cody Gakpo, the world's most in-form attacker. The Dutch starlet has taken his game into a new stratosphere, dominating the Eredivisie before making the World Cup his playground with three goals in as many games. He has 21 goal contributions in 14 Eredivisie games this season and he's scored with his left, right and his head since arriving in Qatar.  Gakpo, statistically, is the best attacker in the world right now. As for the immovable object, meet the U.S. men's national team's defense. Three games, one goal, none from open play. They've stifled the likes of Harry Kane and, at least mostly, Gareth Bale. Pretty good competition by any stretch. They've survived periods in which they've dominated and periods in which they've been dominated. Three different centerbacks have started, and each has had a part to play in leading the USMNT to the knockout stages.  The USMNT, statistically, is right there among the best defensive teams in this World Cup. Entering Friday's games, every other team that has finished the group stage has conceded at least once from open play. So, now what? Cody Gakpo is the breakout star of this World Cup 📈 pic.twitter.com/ryKcIPgZ7c It's hard to reduce a game like Saturday's round-of-16 clash between the USMNT and the Netherlands to one matchup, simply because there are too many storylines to keep track of.  There's Sergino Dest's clash with his home country and Gregg Berhalter's extended stay in Holland as a player. There's the injury to Christian Pulisic, the illness of Frenkie de Jong. Memphis Depay is in the news for trying to choose his own partner up top, while the USMNT's striker situation remains very much in flux. It'll take a combination of things for either side to win this game and book their quarterfinal spot but, in many ways, looking at Gakpo's battle with the USMNT defense is a good place to start. The dynamic 23-year-old is arguably the star of this World Cup, at least so far. He was already making waves with his play for PSV, but the hype has reached overdrive in Qatar. At some point soon, some Premier League club will pay a bazillion dollars for him. That's what happens when you perform in the way he has. Gakpo is actually that damn good.  He hasn't had as many chances as some other forwards, but he surely hasn't wasted the ones he's gotten. Gakpo is one of those players that needs just one opportunity to change a game and, ultimately, a World Cup. So, how does the USMNT counteract that? Well, Berhalter has been doing his homework. ""We've been watching Holland for the last 11 months, watching all their games,"" he said. ""We've had multiple people at their group stage games watching live with the wide angle, so we're gonna do a deep dive on them.  ""All the information was presented to us immediately after the game against Iran and we were able to start preparing."" ""We're looking at how they play, at what they do, how they create chances, how they press,"" Berhalter continued. ""Every face of the play, we're analyzing. We're looking at set pieces, the whole thing."" Credit to Berhalter and his scouting team for how the U.S. has been able to neutralize opponents so far. But credit to the players themselves, too, all of whom have stepped up to a level few saw coming. The centerbacks deserve plenty of credit, especially Tim Ream. How good has he been? For a player that, just a few months ago, was nowhere near the national team picture, Ream has been better than anyone could have ever imagined.  During this World Cup, he's been partnered by two different teammates. Walker Zimmerman started against Wales and England before coming on late against Iran to swat away cross after cross.  Cameron Carter-Vickers, meanwhile, stepped in against Iran, with Berhalter pointing to his ability to play against a team in a low block thanks to his time at Celtic. It hasn't just been the centerbacks, though. Dest has been marvelous at fullback, looking like a completely different player than the one that was, to put it lightly, disinterested when it came to defending for several years.  Antonee Robinson has been his steady self but Tyler Adams has gone supersonic, emerging as an elite defensive midfielder at the most elite level. When you add in the pressing work done by Haji Wright and Josh Sargent up top, you get a clear vision of how the U.S. defend: with everyone doing their part. That is how you generally stop a player like Gakpo. You don't stop him when he gets the ball; you stop him before he gets it. And the USMNT defense has put that line of thinking on full display twice this tournament. Against Wales, the U.S. put Bale in an on-pitch prison cell. He was constantly surrounded by Zimmerman, Ream and the three midfielders. Whenever the ball would go anywhere near him, the door would slam shut, taking away Bale as an option. Then, against England, the U.S. earmarked the centerbacks as the initiators of the Three Lions attack, so they hounded them, not allowing John Stones or Harry Maguire to play with the ball.  It led to a disjointed attacking performance from England as the job was made easier for those deeper in defense thanks to the work of those up front. The USMNT will need to apply those principles against the Netherlands. They'll need to put Virgil van Dijk under pressure. They'll need to surround midfield playmaker De Jong.  And, most importantly, they'll have to make sure that Gakpo never, ever gets the ball in a place where he can make something happen. ""They have some real talent with Memphis Depay and Gakpo and [Steven] Bergwijn, just really top-end talent,"" Berthalter said, ""but for us, it's about the collective.  ""The backline has done a great job. The goalkeeper has done a great job, but it's about team defending, working as a unit, moving collectively. ""And when we do that, we put the opponent in difficult positions where they can't access the spaces they want to access. I think that's been what we've been good at so far."" It's never that easy though, is it? The whole world knows about Gakpo, and Netherlands manager Louis van Gaal knows that the whole world knows about Gakpo. The Dutch boss isn't going to sit back and let things play out; he's going to put his players in a position to shine. He's no doubt been watching hours of film on the U.S. after admitting that, prior to arriving in Qatar, he'd never seen Berhalter's side play.  ""If you watch them play, it's crystal clear they've had opportunities,"" Van Gaal said. ""I don't think it's a surprise to be quite honest.  ""The USA has an excellent 'team'. I would say one of the best 'teams', fine-tuned. It's going to be a very tough match. But it's nothing we can't overcome. We also have a good team, that's my view.  ""We'll have to wait and see in this match which of the two squads is the best. I'm not going to downplay the USA. On the contrary, they're an example of what a good team is supposed to be."" As Van Gaal says, this will be a battle of two talented teams. On paper, the Netherlands may have slightly more quality, but you can't write off a U.S. team that has already gone toe-to-toe with England.  And, in a World Cup, you can never write off a team that has had a defense like the USMNT's. It's hard to lose if you don't concede, right? Saturday's game will likely be a tight, tense affair defined by battles all over the field. The most important of those battles will be between Gakpo and a USMNT defense that will be designed to keep him quiet. They've kept superstars quiet before, though. Who wins, then? Does the force of Gakpo finally meet resistance? Can the Dutch starlet move the immovable?  We're about to find out... Which was the best World Cup winning team? Which was the best World Cup winning team?"
